{
  "schema_version": "3.0",
  "contract_version": "1.0",
  "runtime_id": "claude-code",
  "observed_runtime_version": "2.1.235",
  "release_tag": null,
  "release_commit": null,
  "release_date": null,
  "contract_target": "INSTALLED_RUNTIME",
  "contract_source_commit": null,
  "docs_snapshot_date": "2026-09-10",
  "contract_digest": "sha256:8d25516eaed8a4ad0a746efaf97de3b36e85e735ae6ba188651dc1305b6a00c5",
  "verification_method": "claude --version and claude --help observed locally; claude auth status --json inspected for category keys only; official Claude Code docs reviewed; no immutable source commit exposed",
  "support": "NATIVE",
  "availability": "INSTALLED",
  "native_contract_revision": "claude-cli-help@2.1.235",
  "source_files": [
    "observed-cli:claude --version",
    "observed-cli:claude --help",
    "observed-cli:claude auth --help"
  ],
  "scope": "Only the installed CLI flags and built-in tool surface required by the benchmark-safe print boundary are pinned; this is not a full Claude implementation schema.",
  "update_process": "Re-run the installed version/help probes and refresh this snapshot only after reviewing the matching first-party release documentation; unknown versions fail closed.",
  "authentication_categories": ["UNKNOWN"],
  "surfaces": {
    "CLAUDE.md": {"support": "NATIVE", "availability": "INSTALLED", "notes": "Native persistent project context; disabled for the benchmark by safe-mode."},
    "Skills": {"support": "NATIVE", "availability": "INSTALLED", "notes": "Native skill surface exists; canonical selected procedures are host-managed here to preserve one source of truth."},
    "Hooks": {"support": "NATIVE", "availability": "INSTALLED", "notes": "Available, but not enabled for this read-only lane."},
    "Subagents": {"support": "NATIVE", "availability": "INSTALLED", "notes": "Agent tool exists, but it is outside the H03 allowlist."},
    "Plugins": {"support": "NATIVE", "availability": "INSTALLED", "notes": "Plugin flags exist, but no plugin is loaded."},
    "MCP": {"support": "NATIVE", "availability": "INSTALLED", "notes": "MCP flags exist; strict empty configuration is used."},
    "print": {"support": "NATIVE", "availability": "INSTALLED"},
    "output_format": {"support": "NATIVE", "availability": "INSTALLED"},
    "permission_mode": {"support": "NATIVE", "availability": "INSTALLED"},
    "tools": {"support": "NATIVE", "availability": "INSTALLED"},
    "model": {"support": "NATIVE", "availability": "INSTALLED", "notes": "Supported by CLI but intentionally not selected by this adapter."},
    "effort": {"support": "NATIVE", "availability": "INSTALLED", "notes": "Supported by CLI but not varied in Phase 3D."},
    "safe_mode": {"support": "NATIVE", "availability": "INSTALLED"},
    "no_session_persistence": {"support": "NATIVE", "availability": "INSTALLED"},
    "no_chrome": {"support": "NATIVE", "availability": "INSTALLED"},
    "strict_mcp_config": {"support": "NATIVE", "availability": "INSTALLED"},
    "disable_slash_commands": {"support": "NATIVE", "availability": "INSTALLED"},
    "setting_sources": {"support": "NATIVE", "availability": "INSTALLED"},
    "settings": {"support": "NATIVE", "availability": "INSTALLED"}
  },
  "fields": {
    "agent": {"type": "string", "cli_flag": "--agent"},
    "permission_mode": {"type": "string", "cli_flag": "--permission-mode", "enum": ["acceptEdits", "auto", "bypassPermissions", "manual", "dontAsk", "plan"]},
    "tools": {"type": "array", "cli_flag": "--tools", "items_enum": ["Read", "Glob", "Grep", "Bash", "Edit", "Write", "Agent", "AskUserQuestion", "WebSearch", "WebFetch", "NotebookEdit", "TodoWrite"]},
    "allowed_tools": {"type": "array", "cli_flag": "--allowed-tools", "items_enum": ["Read", "Glob", "Grep", "Bash", "Edit", "Write", "Agent", "AskUserQuestion", "WebSearch", "WebFetch", "NotebookEdit", "TodoWrite"]},
    "disallowed_tools": {"type": "array", "cli_flag": "--disallowed-tools", "items_enum": ["Read", "Glob", "Grep", "Bash", "Edit", "Write", "Agent", "AskUserQuestion", "WebSearch", "WebFetch", "NotebookEdit", "TodoWrite"]},
    "output_format": {"type": "string", "cli_flag": "--output-format", "enum": ["text", "json", "stream-json"]},
    "max_budget_usd": {"type": "number", "cli_flag": "--max-budget-usd", "minimum": 0},
    "no_session_persistence": {"type": "boolean", "cli_flag": "--no-session-persistence"},
    "no_chrome": {"type": "boolean", "cli_flag": "--no-chrome"},
    "safe_mode": {"type": "boolean", "cli_flag": "--safe-mode"},
    "strict_mcp_config": {"type": "boolean", "cli_flag": "--strict-mcp-config"},
    "mcp_config": {"type": "string", "cli_flag": "--mcp-config", "enum": ["{\"mcpServers\":{}}"]},
    "disable_slash_commands": {"type": "boolean", "cli_flag": "--disable-slash-commands"},
    "model": {"type": "string", "cli_flag": "--model"},
    "effort": {"type": "string", "cli_flag": "--effort", "enum": ["low", "medium", "high", "xhigh", "max"]},
    "setting_sources": {"type": "string", "cli_flag": "--setting-sources"},
    "settings": {"type": "string", "cli_flag": "--settings"},
    "append_system_prompt": {"type": "string", "cli_flag": "--append-system-prompt"},
    "plugin_dir": {"type": "array", "cli_flag": "--plugin-dir"},
    "plugin_url": {"type": "array", "cli_flag": "--plugin-url"}
  }
}
